{
  "protocolVersion": "0.4",
  "requestId": "acceptance_request_fixture",
  "commandType": "acceptance.record",
  "presenceRegistrationId": "presence_fixture",
  "aggregate": {
    "kind": "outcome",
    "id": "outcome_fixture",
    "expectedRevision": 1
  },
  "decision": "accept",
  "evidenceSetDigest": "sha256:f16d05ec6b29248d2c61adb1e9263f78e4f7bace1b955014a2d17872cfe4064d",
  "verificationIds": [
    "verification_fixture"
  ],
  "reasonRef": null,
  "clientIssuedAt": "2026-08-13T12:03:00.000Z"
}
